"2023-01-31T11:35:01","TechScape: Why Donald Trump’s return to Facebook could mark a rocky new age for online discourse"
"2023-02-02T14:06:10","Unopened first-generation iPhone set to sell for $50,000 at US auction"
"2023-02-02T22:50:07","Apple posts first revenue drop in four years"
"2023-02-03T06:39:11","Some popular accounts likely to disappear from Twitter as Elon Musk ends free access to API"
"2023-02-08T07:00:11","OnePlus 11 review: rapid Android with long battery life"
"2023-02-09T07:00:18","OnePlus Buds Pro 2 review: good-sounding earbuds with spatial audio for Android"
"2023-02-13T07:00:47","Mac mini M2 review: Apple’s cheaper, tiny but mighty computer"
"2023-02-14T11:45:53","TechScape: How Nintendo’s stayed the most innovative tech company of our time"
"2023-02-15T14:00:13","Australians able to opt out of targeted ads and erase their data under proposed privacy reforms"
"2023-02-20T07:00:30","MacBook Pro M2 Pro review: Apple’s best laptop gets more power and battery life"
"2023-02-20T17:08:13","Does paid-for Facebook and Instagram signal end of free-access orthodoxy?"
"2023-02-28T06:00:15","‘Scanners are complicated’: why Gen Z faces workplace ‘tech shame’"
"2023-02-28T11:17:49","TechScape: Seven top AI acronyms explained"
"2023-03-01T19:54:46","NSO Group co-founder emerges as new majority owner"
"2023-03-02T06:00:06","Last night AI DJ saved my life? Testing Spotify’s virtual radio host"
"2023-03-03T14:01:18","‘Spy balloon in your phone’: growing calls to ban TikTok threaten its future"
"2023-03-07T06:53:54","TikTok bans on Australian government-issued phones should be extended to other apps, experts say"
"2023-03-08T17:29:51","TikTok unveils European data security plan amid calls for US ban"
"2023-03-12T12:00:48","Has the 3D printing revolution finally arrived?"
"2023-03-17T00:19:47","The TikTok wars – why the US and China are feuding over the app"
"2023-03-18T16:00:15","‘ChatGPT said I did not exist’: how artists and writers are fighting back against AI"
"2023-03-20T07:00:04","Apple HomePod review: a Siri speaker with a bass problem"
"2023-03-23T14:47:02","From Facebook intern to the crosshairs of Congress: TikTok chief’s stellar rise"
"2023-03-26T13:28:43","Blood glucose monitoring technology designed for the Apple Watch is unlikely to launch for several years, Bloomberg reporter Mark Gurman believes.





In February, Gurman reported that Apple has made major progress with its noninvasive blood glucose monitori…"
"2023-03-27T14:21:39","Apple Music Classical app is scheduled to launch on Tuesday, March 28, but it appears that the app is beginning to roll out for some iPhone users in some Asian countries, such as Malaysia, Thailand, the Philippines, and Vietnam, according to Twitter users.


…"
"2023-03-27T17:01:00","Alongside the iOS 16.4, iPadOS 16.4, tvOS 16.4, and macOS Ventura 13.3 updates, Apple has released new 16.4 software created for the HomePod and HomePod mini. 





According to Apple's release notes, the update adds stability and performance improvements to …"
"2023-03-27T17:32:52","Alongside the macOS Ventura 13.3 update, Apple has released new 16.4 firmware that's designed for the Studio Display. 





The Studio Display firmware can be updated by connecting it to a Mac. Studio Display owners can go to System Preferences > Software Upd…"
"2023-03-27T19:05:38","The watchOS 9.4 update that came out today has a hidden feature that is designed to allow you to delete built-in apps directly from the Apple Watch. Apple did not mention this function in the release notes for the update, but a support document on deleting bu…"
"2023-03-28T03:54:48","Apple today published a support document explaining why it decided to release a standalone Apple Music Classical app for classical music.





In short, Apple says the app was designed to support classical music's complex metadata:Classical music is different…"
"2023-03-28T09:51:44","Apple Music Classical is now available for everyone to download in the App Store, at last fulfilling the company's promise to offer a dedicated classical music app. Apple originally planned to launch a classical music app in 2022, but the app was not announce…"
"2023-03-28T14:00:58","Apple is once again facing accusations of cracking down on union organizers. The Communications Workers of America union (CWA) has filed charges with the National Labor Relations Board (NLRB) asserting that Apple illegally intimidated and fired workers at Hou…"
"2023-03-28T14:31:02","Following the launch of Apple Music Classical, the first TV ad for the classical music streaming service has been released. The 30-second video features pianist Alice Sara Ott and conductor Karina Canellakis performing Beethoven's Piano Concerto No. 1.





…"
"2023-03-28T14:57:00","China urges Apple to strengthen data security  Reuters.com"
"2023-03-28T15:36:26","Apple today announced that it will begin inviting ""randomly selected users"" to use a prerelease version of Apple Pay Later via the Wallet app and emails sent to Apple IDs. Apple Pay Later is available in the U.S. starting with iOS 16.4 and iPadOS 16.4.





A…"
"2023-03-28T15:43:00","Apple: Apple today introduced Apple Pay Later in the U.S. Designed with users' financial health in mind, Apple Pay Later allows users to split purchases into four payments, spread over six weeks with no interest and no fees. Users can easily track, manage, an…"
"2023-03-28T15:45:00","Apple launches buy now, pay later service  Reuters.com"
"2023-03-28T18:53:42","The iOS 16.5 beta that Apple seeded to developers today doesn't appear to have many features as of yet, but one change has been made to the Apple News app. To go along with its push into sports content, Apple has added a new Sports tab to the app.





Apple …"
"2023-03-28T20:46:05","Apple Pay Later is a buy now, pay later lender that allows you to spread out the cost of a purchase into four installments spread out over six weeks."
"2023-03-29T16:58:43","Apple today announced that its 34th annual Worldwide Developers Conference will take place from Monday, June 5 to Friday, June 9. Like WWDC 2020, 2021, and 2022, WWDC 2023 will be an online event for the most part, and it will include all developers at no cos…"
"2023-03-29T17:26:00","What will Apple show at its big conference?"
"2023-03-29T18:46:37","In addition to iOS 17 and macOS 14, Apple could announce its XR platform."
"2023-03-29T20:56:33","Apple today released an iTunes 12.12.8 update for Windows, with the software introducing security improvements and ""support for new devices."" This is the first update to iTunes since iTunes 12.12.7, which came out in December 2022.





The ""new devices"" that…"
"2023-03-30T11:15:30","Apple has set the dates for WWDC 2023, which will run between June 5th and June 9th. It's still an online-only affair, but there will be a ""special experience"" at Apple Park on the 5th for developers and students.While we expect to see software-centric upgrad…"
"2023-03-30T16:49:21","Apple today added refurbished Apple Watch Series 8 and Apple Watch SE 2 models to its online store in the United States, offering the latest Apple Watches at a discounted price for the first time.





The ‌Apple Watch Series 8‌ is available starting at $339 …"
"2023-03-30T18:48:00","Apple today updated its Pages, Numbers, and Keynote apps for iPad with Apple Pencil hover support. Apple says this feature ""makes it easy to navigate, write, sketch, and illustrate with greater precision"" on the latest 11-inch and 12.9-inch iPad Pro.





The…"
"2023-03-31T08:18:08","Specialist jeweler De Billas Lux has caused a stair among timepiece collectors by offering a custom Apple Watch Ultra model with an anodized blue titanium case.





The Digital Crown is anodized in gold, and the Action button, while retaining an Internationa…"
"2023-03-31T16:41:00","Apple wins appeal against UK's decision to investigate its mobile ...  Reuters.com"
"2023-03-31T22:50:00","Apple wins reversal of $502 mln VirnetX patent infringement verdict  Reuters.com"
"2023-04-03T14:40:32","The Apple Watch SE is back on sale for $219 at Amazon and Best Buy, bringing what was already one of the better values on the wearable market within $10 of the lowest price we've tracked. Though we've seen this deal a few times since the SE launched last Sept…"
"2023-04-03T20:01:51","The Macs are matching their lowest tracked prices, as are the latest Kindles."
"2023-04-03T22:01:00","Apple to cut small number of jobs in some corporate retail teams ...  Reuters"
"2023-04-03T22:18:01","Apple is planning to cut a small number of corporate retail employees that are on its development and preservation teams, reports Bloomberg. The employees that are part of the downsizing handle the construction and upkeep of Apple retail locations worldwide.
…"
"2023-04-04T13:15:53","Now that spring is making outdoor walks more of a pleasure, you might want some wireless earbuds — and thankfully, Amazon is making them more affordable. The retailer is again selling Apple's third-generation AirPods for $150, or $20 off. That's a record-low …"
"2023-04-04T13:54:09","You might not want to rely on Apple's built-in Weather app to see if you need a jacket today. As Apple's status page confirms, many users are reporting that the app isn't loading information on all of the company's platforms, including iOS and macOS. We've as…"
"2023-04-04T14:40:00","The Apple weather app appears to be struggling to meet consumer expectations by simply not working. As more and more people rely on technology, we’ve become dependent on it for nearly everything, including the (usually) quick and easy step of referring to a w…"
"2023-04-04T17:15:00","Apple Music trademark application blocked by U.S. appeals court  Reuters.com"
"2023-04-05T02:06:59","Apple services except for iCloud will stop working on some older iOS, macOS, watchOS, and tvOS versions starting in early May, according to information shared by Twitter account @StellaFudge, a source with a proven track record.





Users will not be able to…"
"2023-04-05T12:13:00","Apple to open first company-owned retail store in India  Reuters"
"2023-04-05T17:10:46","Now through April 11, iPhone users can get six Chicken McNuggets for free when they make a minimum $1 purchase in the McDonald's app with Apple Pay. The limited-time offer is available at participating McDonald's restaurants in the United States.





The off…"
"2023-04-06T09:46:51","Apple is finally getting ready to open its first physical store in the country as it bets on India as a market and manufacturing base."
"2023-04-06T23:44:00","Future Apple Watches could have more delicate finger tracking, an Apple patent application suggests."
"2023-04-07T17:11:28","Apple today released macOS Ventura 13.3.1, a minor update to the ‌macOS Ventura‌ operating system released last October. ‌macOS Ventura‌ 13.3.1 comes almost two weeks after the launch of macOS Ventura 13.3.





The ‌‌‌‌macOS Ventura‌‌‌‌ 13.3.1 update can be …"
"2023-04-07T21:33:39","Burglars stole approximately $500,000 worth of iPhones, Apple Watches, and other inventory from an Apple Store outside Seattle, local police said."
"2023-04-09T12:00:00","Unleash your inner diva as you grab the mic on your favorite songs."
"2023-04-09T22:35:28","Apple appears to have taken its most aggressive step yet to warn its retail employees against unionizing. According to Bloomberg
, the company recently held meetings at all of its roughly 270 stores across the United States. The tone of the gatherings was “c…"
"2023-04-10T07:18:00","Global PC shipments slide in Q1, Apple takes biggest hit - IDC  Reuters"
"2023-04-11T01:29:00","Several Apple services down for some users - Downdetector  Reuters"
"2023-04-11T13:00:00","Your iPhone, iPad, and Mac now have a built-in password feature, complete with two-factor authentication."
"2023-04-11T13:50:18","Apple today announced that its first two retail stores in India will be opening next week. To celebrate the occasion, Apple has made special wallpapers for the iPhone, iPad, and Mac available to download on its website, with direct links provided below.





…"
"2023-04-11T19:46:33","Apple's AirPods, AirPods Pro, and AirPods Max headphones regularly receive over-the-air firmware updates that are installed through an iPhone, iPad, or Mac, but for those who do not have an Apple device, there is no way to get new firmware on their own.





…"
"2023-04-12T17:19:14","Apple today released new tvOS 16.4.1 software for the Apple TV models and HomePod 16.4.1 software for the ‌HomePod‌ and the HomePod mini.





According to Apple's release notes for the update on the ‌HomePod‌, it includes performance and stability improvemen…"
"2023-04-12T21:35:00","Just what the hell is happening with the iPhone 15’s external buttons? Despite numerous leaks and countless reports that premium iPhone 15s would ditch physical buttons and get new, trackpad-like touch-based controls, the Cupertino company may have made a las…"
"2023-04-12T23:49:35","Apple appears to be gearing up to introduce the Daily Cash savings account feature for Apple Card users, as mentions of a Daily Cash Savings account have been found in backend Apple code by Aaronp613.





The appearance of the code indicates that Apple has f…"
"2023-04-13T11:51:32","Apple plans to let iPhone users in China customize their transit cards with illustrated designs in celebration of Earth Day on Saturday, April 22, according to details found in backend Apple Wallet code by Aaronp613.





Users who keep transit cards in the W…"
"2023-04-13T14:31:50","Apple Card Savings will likely be available starting Monday, April 17, according to backend code on Apple's servers uncovered by @aaronp613. The code also suggests that an iPhone with iOS 16.3 or later will be required to use the feature.





Apple Card user…"
"2023-04-13T15:52:00","<ol><li>Apple to use more recycled materials in its products by 2025  Times of India
</li><li>Apple to use only recycled cobalt in batteries by 2025  Yahoo Canada Finance
</li><li>Apple commits to using 100 percent recycled cobalt in batteries by 2025  Mobi…"
"2023-04-14T20:47:23","Apple's rumored multi-view sports feature will be available for tonight's MLB Friday Night Baseball games, and tomorrow's MLS Season Pass matches, according to Tom's Guide. The feature requires an Apple TV 4K running the tvOS 16.5 beta.





An expansion of t…"
"2023-04-14T21:55:07","Apple TV 4K is getting a new multiview feature that lets you watch multiple sports streams at once, according to a report from TechCrunch. The feature is available within the tvOS 16.5 beta."
"2023-04-15T15:41:31","Apple’s forthcoming 15-inch MacBook Air
 will feature a processor “on par” with the company’s current M2 chip. According to Bloomberg
, Apple recently began testing the laptop to ensure its compatibility with third-party App Store apps, something the compan…"
"2023-04-16T03:08:00","Apple TV down for thousands of US users -Downdetector  Reuters"
"2023-04-17T11:35:00","Apple CEO Cook to meet Indian PM Modi amid expansion - sources  Reuters"
"2023-04-17T19:09:32","Apple expands financial services push as the hardware market remains tumultuous."
"2023-04-17T19:56:00","Apple released a new high-yield savings account from Goldman Sachs for Apple Card users. The account pays 4.15% APY, and it has no fees or minimum balance requirements."
"2023-04-17T21:19:00","Apple offers high-yield savings to card customers as deposit ...  Reuters"
"2023-04-18T04:55:00","Apple craze draws long queues at opening of first India store  Reuters India"
"2023-04-18T16:10:00","Israeli digital surveillance for hire giant NSO Group reportedly deployed at least three new attacks last year targeting human rights workers and other members of civil society spread out around the world using Apple devices. All of those “zero-click” exploit…"
"2023-04-18T19:23:16","Apple is reportedly readying a wide array of apps and services for its upcoming mixed reality headset, according toBloomberg’s Mark Gurman. The company appears to be moving forward with plans to announce its first VR / AR headset at its Worldwide Developers’ …"
"2023-04-18T22:02:00","Apple's legal battle with pulse oximetry company Masimo has been taking place over the course of the last two weeks, but we've heard little about it because it's being done behind closed doors. The judge overseeing the case sealed the trial, but legal affairs…"
"2023-04-19T14:34:03","Apple today published its 2023 Environmental Progress Report, setting out the company's ongoing efforts to combat climate change and reduce its impact on the environment.





The report explores Apple's chemical research, recycling and device recovery operat…"
"2023-04-20T16:00:00","Aspiring partners accuse Apple of copying their ideas. From a report: It sounded like a dream partnership when Apple reached out to Joe Kiani, the founder of a company that makes blood-oxygen measurement devices. He figured his technology was a perfect fit fo…"
"2023-04-21T13:17:29","Hannah Waddingham will host the upcoming Apple TV Plus special Hannah Waddingham: Home for Christmas in front of a live audience later this year."
"2023-04-21T16:19:50","Another Friday, another roundup of the best tech deals we could find. Our latest selection includes the iPad Air for $500, which is $99 off Apple's list price and a good value for a tablet we've called the best iPad for most people. Beyond that, the 55-inch L…"
"2023-04-22T04:54:00","Taiwan's Apple supplier Quanta plans Vietnam factory  Reuters.com"
"2023-04-23T15:17:41","If you missed the chance to buy Apple’s 2022 iPad
 when it was $50 off earlier this month, now you have another opportunity to purchase the tablet at a discount. For the time being, Amazon is offering the device at a starting price of $399. That’s a return t…"
"2023-04-23T17:13:41","At the start of 2023, Bloomberg’s Gurman reported
 Apple’s forthcoming mixed-reality headset would feature an external power supply. At the time, he said the company made the decision to offload the battery for a few reasons. Apple was concerned about the de…"
"2023-04-24T16:00:00","Batteries still suck, especially if you’re trying to keep costs low and not weigh a device down with unnecessary lithium. That’s a problem for Apple and its upcoming mixed-reality headset. In his latest newsletter, Bloomberg’s Mark Gurman offered a few more h…"
"2023-04-24T19:13:31","An appeals court has issued a ruling in the long-running antitrust tussle between Apple
 and Epic Games
. As Bloomberg
 reports, the US Ninth Circuit Court of Appeals upheld a lower court ruling, which rejected most of Epic's claims that Apple violated fed…"
"2023-04-25T12:20:11","Apple has released updates for its Apple Music, Apple TV, and Apple Devices apps for PC users running Windows 11, bringing what appear to be notable improvements and bug fixes to the preview apps.





Last year, Microsoft said that Apple Music and Apple TV a…"
